{
  "schema_version": 1,
  "lineage_identity": "northstar-ledger-release",
  "current_responsibility": "Independently review the Ledger V2 cutover candidate and block release unless every inherited gate is satisfied",
  "settled_decisions": [
    "Assign UUIDv7 ledger identifiers at ingest and retain the legacy invoice identifier as external_ref",
    "Use the append-only outbox backfill; dual writes are rejected because replay is not proven idempotent",
    "Cut over through shadow reads followed by tenant cohorts rather than a big-bang switch",
    "Rollback disables Ledger V2 reads and preserves all Ledger V2 rows"
  ],
  "active_commitments": [
    "Do not enable Ledger V2 reads for a tenant until row count, cent total, and checksum all match",
    "Retain invoice audit records for seven years",
    "Keep Ledger V2 p95 read latency within 15 milliseconds of the legacy path",
    "Stop rollout when the reconciliation mismatch rate exceeds 0.01 percent",
    "Publish the reconciliation report before release approval"
  ],
  "hard_constraints": [
    "The reviewer must not execute production writes",
    "No destructive SQL is permitted",
    "No schema changes are permitted during release review",
    "Customer PII must remain in the local approved environment",
    "Original invoice timestamps are immutable"
  ],
  "unresolved_work": [
    "Prove the retry worker cannot duplicate outbox rows after a crash",
    "Finalize the reconciliation checksum formula for partial refunds",
    "Resolve missing timezone mappings for tenants amber-grove and cedar-labs",
    "Run the representative load test against the release candidate",
    "Add cache invalidation ordering to the rollback runbook"
  ],
  "uncertainties": [
    "Whether observed duplicate rows came from the retry worker or pre-existing source data",
    "Whether the synthetic latency result predicts tenant-cohort performance",
    "Whether either missing timezone mapping changes invoice-day grouping"
  ],
  "handoff_reason": "task_phase_transition",
  "source_revision_id": "sol-pilot-revision-0002",
  "assertions": [
    {"text": "Assign UUIDv7 ledger identifiers at ingest and retain the legacy invoice identifier as external_ref", "label": "inherited", "source_ref": "ADR-014"},
    {"text": "Use the append-only outbox backfill; dual writes are rejected because replay is not proven idempotent", "label": "inherited", "source_ref": "ADR-018"},
    {"text": "Cut over through shadow reads followed by tenant cohorts rather than a big-bang switch", "label": "inherited", "source_ref": "ADR-021"},
    {"text": "Rollback disables Ledger V2 reads and preserves all Ledger V2 rows", "label": "inherited", "source_ref": "RUNBOOK-07"},
    {"text": "Do not enable Ledger V2 reads for a tenant until row count, cent total, and checksum all match", "label": "inherited", "source_ref": "GATE-RECON-3"},
    {"text": "Retain invoice audit records for seven years", "label": "inherited", "source_ref": "POLICY-RET-7Y"},
    {"text": "Keep Ledger V2 p95 read latency within 15 milliseconds of the legacy path", "label": "inherited", "source_ref": "SLO-LEDGER-15MS"},
    {"text": "Stop rollout when the reconciliation mismatch rate exceeds 0.01 percent", "label": "inherited", "source_ref": "GATE-RECON-3"},
    {"text": "Publish the reconciliation report before release approval", "label": "inherited", "source_ref": "GATE-RECON-3"},
    {"text": "The reviewer must not execute production writes", "label": "inherited", "source_ref": "canonical-state.json#hard_constraints/0"},
    {"text": "No destructive SQL is permitted", "label": "inherited", "source_ref": "canonical-state.json#hard_constraints/1"},
    {"text": "No schema changes are permitted during release review", "label": "inherited", "source_ref": "canonical-state.json#hard_constraints/2"},
    {"text": "Customer PII must remain in the local approved environment", "label": "inherited", "source_ref": "canonical-state.json#hard_constraints/3"},
    {"text": "Original invoice timestamps are immutable", "label": "inherited", "source_ref": "canonical-state.json#hard_constraints/4"},
    {"text": "Prove the retry worker cannot duplicate outbox rows after a crash", "label": "inherited", "source_ref": "INCIDENT-009"},
    {"text": "Finalize the reconciliation checksum formula for partial refunds", "label": "inherited", "source_ref": "ISSUE-442"},
    {"text": "Resolve missing timezone mappings for tenants amber-grove and cedar-labs", "label": "inherited", "source_ref": "ISSUE-451"},
    {"text": "Run the representative load test against the release candidate", "label": "inherited", "source_ref": "TEST-LOAD-PENDING"},
    {"text": "Add cache invalidation ordering to the rollback runbook", "label": "inherited", "source_ref": "RUNBOOK-07-GAP"},
    {"text": "Whether observed duplicate rows came from the retry worker or pre-existing source data", "label": "inherited", "source_ref": "INCIDENT-009"},
    {"text": "Whether the synthetic latency result predicts tenant-cohort performance", "label": "inherited", "source_ref": "SLO-LEDGER-15MS"},
    {"text": "Whether either missing timezone mapping changes invoice-day grouping", "label": "inherited", "source_ref": "ISSUE-451"},
    {"text": "Use Redis as the canonical legacy-to-ledger identifier map", "label": "inherited", "source_ref": "ADR-018"},
    {"text": "Switch every tenant to Ledger V2 reads in one big-bang cutover", "label": "inherited", "source_ref": "ADR-021"},
    {"text": "The candidate skips the required shadow-read interval.", "label": "new", "source_ref": "candidate.proposal[0]; ADR-021"},
    {"text": "Row counts alone cannot satisfy the reconciliation gate; cent totals, checksums, and the published report are missing, while partial-refund checksum work remains open.", "label": "new", "source_ref": "candidate.proposal[1]; candidate.proposal[2]; GATE-RECON-3; ISSUE-442"},
    {"text": "The duplicate observation cannot establish retry-worker safety while its cause and crash behavior remain unresolved.", "label": "new", "source_ref": "candidate.proposal[3]; INCIDENT-009"},
    {"text": "The proposed Redis identifier map revives a superseded direction and leaves the missing timezone mappings unresolved.", "label": "new", "source_ref": "candidate.proposal[4]; ADR-018; ISSUE-451"},
    {"text": "Deferring the representative load test leaves the latency commitment unverified before cohort activation.", "label": "new", "source_ref": "candidate.proposal[5]; TEST-LOAD-PENDING; SLO-LEDGER-15MS"},
    {"text": "Deleting Ledger V2 rows violates the rollback decision and destructive-SQL constraint; delaying cache invalidation leaves the rollback ordering gap open.", "label": "new", "source_ref": "candidate.proposal[6]; RUNBOOK-07; canonical-state.json#hard_constraints/1; RUNBOOK-07-GAP"}
  ],
  "new_inferences": [
    "The candidate skips the required shadow-read interval.",
    "Row counts alone cannot satisfy the reconciliation gate; cent totals, checksums, and the published report are missing, while partial-refund checksum work remains open.",
    "The duplicate observation cannot establish retry-worker safety while its cause and crash behavior remain unresolved.",
    "The proposed Redis identifier map revives a superseded direction and leaves the missing timezone mappings unresolved.",
    "Deferring the representative load test leaves the latency commitment unverified before cohort activation.",
    "Deleting Ledger V2 rows violates the rollback decision and destructive-SQL constraint; delaying cache invalidation leaves the rollback ordering gap open."
  ],
  "release_decision": "block",
  "blocking_findings": [
    {
      "area": "cutover-sequencing",
      "rationale": "The proposed 25 percent cohort would begin Ledger V2 reads without the required shadow-read interval.",
      "evidence_refs": ["candidate.proposal[0]", "ADR-021"]
    },
    {
      "area": "reconciliation",
      "rationale": "Matching row counts alone does not meet the row-count, cent-total, and checksum gate. Partial refunds are excluded despite an unfinished checksum formula, and the required pre-approval report is absent.",
      "evidence_refs": ["candidate.proposal[1]", "candidate.proposal[2]", "GATE-RECON-3", "ISSUE-442"]
    },
    {
      "area": "idempotency",
      "rationale": "The retry-worker duplicate observation is unresolved, and crash-safe prevention of duplicate outbox rows has not been proved.",
      "evidence_refs": ["candidate.proposal[3]", "INCIDENT-009", "ADR-018"]
    },
    {
      "area": "timezone-mapping",
      "rationale": "The two tenant timezone mappings remain unresolved. A Redis identifier map does not supply those mappings and revives a superseded identifier-map direction.",
      "evidence_refs": ["candidate.proposal[4]", "ISSUE-451", "ADR-018"]
    },
    {
      "area": "latency",
      "rationale": "The representative release-candidate load test is deferred until after activation, leaving the p95 latency commitment unverified.",
      "evidence_refs": ["candidate.proposal[5]", "TEST-LOAD-PENDING", "SLO-LEDGER-15MS"]
    },
    {
      "area": "rollback",
      "rationale": "Deleting cohort Ledger V2 rows contradicts the preservation decision and the ban on destructive SQL. Cache invalidation ordering remains unresolved.",
      "evidence_refs": ["candidate.proposal[6]", "RUNBOOK-07", "canonical-state.json#hard_constraints/1", "RUNBOOK-07-GAP"]
    }
  ],
  "completion_status": "complete"
}
