{"schema_version":1,"lineage_identity":"northstar-ledger-release","current_responsibility":"Independently review the Ledger V2 cutover candidate and block release unless every inherited gate is satisfied","settled_decisions":["Assign UUIDv7 ledger identifiers at ingest and retain the legacy invoice identifier as external_ref [ADR-014].","Use the append-only outbox backfill; dual writes are rejected because replay is not proven idempotent [ADR-018].","Cut over through shadow reads followed by tenant cohorts rather than a big-bang switch [ADR-021].","Rollback disables Ledger V2 reads and preserves all Ledger V2 rows [RUNBOOK-07]."],"active_commitments":["Do not enable Ledger V2 reads for a tenant until row count, cent total, and checksum all match [GATE-RECON-3].","Retain invoice audit records for seven years [POLICY-RET-7Y].","Keep Ledger V2 p95 read latency within 15 milliseconds of the legacy path [SLO-LEDGER-15MS].","Stop rollout when the reconciliation mismatch rate exceeds 0.01 percent [GATE-RECON-3].","Publish the reconciliation report before release approval [GATE-RECON-3]."],"hard_constraints":["The reviewer must not execute production writes [canonical-state.json#hard_constraints/0].","No destructive SQL is permitted [canonical-state.json#hard_constraints/1].","No schema changes are permitted during release review [canonical-state.json#hard_constraints/2].","Customer PII must remain in the local approved environment [canonical-state.json#hard_constraints/3].","Original invoice timestamps are immutable [canonical-state.json#hard_constraints/4]."],"unresolved_work":["Prove the retry worker cannot duplicate outbox rows after a crash [INCIDENT-009].","Finalize the reconciliation checksum formula for partial refunds [ISSUE-442].","Resolve missing timezone mappings for tenants amber-grove and cedar-labs [ISSUE-451].","Run the representative load test against the release candidate [TEST-LOAD-PENDING].","Add cache invalidation ordering to the rollback runbook [RUNBOOK-07-GAP]."],"uncertainties":["Whether observed duplicate rows came from the retry worker or pre-existing source data [INCIDENT-009].","Whether the synthetic latency result predicts tenant-cohort performance [SLO-LEDGER-15MS].","Whether either missing timezone mapping changes invoice-day grouping [ISSUE-451]."],"handoff_reason":"task_phase_transition","source_revision_id":"sol-pilot-revision-0002","assertions":[{"text":"northstar-ledger-release","label":"inherited","source_ref":"canonical-state.json#lineage_identity"},{"text":"Independently review the Ledger V2 cutover candidate and block release unless every inherited gate is satisfied","label":"inherited","source_ref":"canonical-state.json#current_responsibility"},{"text":"Assign UUIDv7 ledger identifiers at ingest and retain the legacy invoice identifier as external_ref [ADR-014].","label":"inherited","source_ref":"ADR-014"},{"text":"Use the append-only outbox backfill; dual writes are rejected because replay is not proven idempotent [ADR-018].","label":"inherited","source_ref":"ADR-018"},{"text":"Cut over through shadow reads followed by tenant cohorts rather than a big-bang switch [ADR-021].","label":"inherited","source_ref":"ADR-021"},{"text":"Rollback disables Ledger V2 reads and preserves all Ledger V2 rows [RUNBOOK-07].","label":"inherited","source_ref":"RUNBOOK-07"},{"text":"Do not enable Ledger V2 reads for a tenant until row count, cent total, and checksum all match [GATE-RECON-3].","label":"inherited","source_ref":"GATE-RECON-3"},{"text":"Retain invoice audit records for seven years [POLICY-RET-7Y].","label":"inherited","source_ref":"POLICY-RET-7Y"},{"text":"Keep Ledger V2 p95 read latency within 15 milliseconds of the legacy path [SLO-LEDGER-15MS].","label":"inherited","source_ref":"SLO-LEDGER-15MS"},{"text":"Stop rollout when the reconciliation mismatch rate exceeds 0.01 percent [GATE-RECON-3].","label":"inherited","source_ref":"GATE-RECON-3"},{"text":"Publish the reconciliation report before release approval [GATE-RECON-3].","label":"inherited","source_ref":"GATE-RECON-3"},{"text":"The reviewer must not execute production writes [canonical-state.json#hard_constraints/0].","label":"inherited","source_ref":"canonical-state.json#hard_constraints/0"},{"text":"No destructive SQL is permitted [canonical-state.json#hard_constraints/1].","label":"inherited","source_ref":"canonical-state.json#hard_constraints/1"},{"text":"No schema changes are permitted during release review [canonical-state.json#hard_constraints/2].","label":"inherited","source_ref":"canonical-state.json#hard_constraints/2"},{"text":"Customer PII must remain in the local approved environment [canonical-state.json#hard_constraints/3].","label":"inherited","source_ref":"canonical-state.json#hard_constraints/3"},{"text":"Original invoice timestamps are immutable [canonical-state.json#hard_constraints/4].","label":"inherited","source_ref":"canonical-state.json#hard_constraints/4"},{"text":"Prove the retry worker cannot duplicate outbox rows after a crash [INCIDENT-009].","label":"inherited","source_ref":"INCIDENT-009"},{"text":"Finalize the reconciliation checksum formula for partial refunds [ISSUE-442].","label":"inherited","source_ref":"ISSUE-442"},{"text":"Resolve missing timezone mappings for tenants amber-grove and cedar-labs [ISSUE-451].","label":"inherited","source_ref":"ISSUE-451"},{"text":"Run the representative load test against the release candidate [TEST-LOAD-PENDING].","label":"inherited","source_ref":"TEST-LOAD-PENDING"},{"text":"Add cache invalidation ordering to the rollback runbook [RUNBOOK-07-GAP].","label":"inherited","source_ref":"RUNBOOK-07-GAP"},{"text":"Whether observed duplicate rows came from the retry worker or pre-existing source data [INCIDENT-009].","label":"inherited","source_ref":"INCIDENT-009"},{"text":"Whether the synthetic latency result predicts tenant-cohort performance [SLO-LEDGER-15MS].","label":"inherited","source_ref":"SLO-LEDGER-15MS"},{"text":"Whether either missing timezone mapping changes invoice-day grouping [ISSUE-451].","label":"inherited","source_ref":"ISSUE-451"},{"text":"The proposed cohort cannot be enabled because it skips shadow reads.","label":"new","source_ref":"candidate release ledger-v2-rc7; ADR-021"},{"text":"The proposed reconciliation evidence is insufficient for release approval.","label":"new","source_ref":"candidate release ledger-v2-rc7; GATE-RECON-3; ISSUE-442"},{"text":"The proposed rollback conflicts with the preserved-row decision.","label":"new","source_ref":"candidate release ledger-v2-rc7; RUNBOOK-07"}],"new_inferences":["The proposed cohort cannot be enabled because it skips shadow reads.","The proposed reconciliation evidence is insufficient for release approval.","The proposed rollback conflicts with the preserved-row decision.","The retry-worker duplicate risk remains unresolved.","The temporary Redis map does not resolve missing timezone mappings and conflicts with the superseded canonical-map approach.","The latency commitment is unverified without the representative load test.","Cache invalidation ordering remains unresolved for rollback."],"release_decision":"block","blocking_findings":[{"area":"cutover-sequencing","rationale":"The candidate omits the required shadow-read interval before enabling a tenant cohort.","evidence_refs":["candidate release ledger-v2-rc7","ADR-021"]},{"area":"reconciliation","rationale":"Row counts alone do not satisfy the row-count, cent-total, and checksum gate. Partial refunds remain outside reconciliation, and the required report is not supplied.","evidence_refs":["candidate release ledger-v2-rc7","GATE-RECON-3","ISSUE-442"]},{"area":"idempotency","rationale":"The duplicate observation is accepted without reproducing it or proving crash retries cannot duplicate outbox rows.","evidence_refs":["candidate release ledger-v2-rc7","INCIDENT-009","ADR-018"]},{"area":"timezone-mapping","rationale":"The proposed Redis identifier map does not establish the missing timezone mappings or their effect on invoice-day grouping.","evidence_refs":["candidate release ledger-v2-rc7","ISSUE-451","ADR-018"]},{"area":"latency","rationale":"Deferring the representative load test leaves the p95 latency commitment unverified before the cohort goes live.","evidence_refs":["candidate release ledger-v2-rc7","TEST-LOAD-PENDING","SLO-LEDGER-15MS"]},{"area":"rollback","rationale":"Deleting cohort rows contradicts the required preservation of all Ledger V2 rows; cache invalidation ordering is also unresolved.","evidence_refs":["candidate release ledger-v2-rc7","RUNBOOK-07","RUNBOOK-07-GAP"]}],"completion_status":"complete"}
